{
  "budget_authorization": {
    "authority": "HO",
    "authorized": true,
    "units": 1
  },
  "created_at": "2026-09-05T09:04:53.249897Z",
  "origin_requirement_ids": [
    "REQ-001"
  ],
  "parent_route_ids": [
    "ER-101"
  ],
  "provenance": {
    "authorization_record": "demo-explicit"
  },
  "reason": "Search one bounded alternate evidence context.",
  "redigestion_request_id": "RDR-001",
  "research_state_id": "RS-002",
  "schema_version": "3.0-post-p1p5-b",
  "status": "AUTHORIZED",
  "trigger_collision_ids": [
    "CA-001"
  ],
  "trigger_obligation_ids": [
    "EO-001"
  ]
}
